{
  "domain": "coldchain-trust",
  "schema_version": 1,
  "generated_at": "2026-09-12T00:00:00Z",
  "sensors": [
    {
      "sensor_id": "S1",
      "hw_serial": "HW-S1-7781",
      "attestation_key_id": "AKID-S1",
      "model": "TL-200"
    },
    {
      "sensor_id": "S2",
      "hw_serial": "HW-S2-3320",
      "attestation_key_id": "AKID-S2",
      "model": "TL-200"
    },
    {
      "sensor_id": "S4",
      "hw_serial": "HW-S4-1198",
      "attestation_key_id": "AKID-S4",
      "model": "TL-200"
    },
    {
      "sensor_id": "S5",
      "hw_serial": "HW-S5-1205",
      "attestation_key_id": "AKID-S5",
      "model": "TL-200"
    },
    {
      "sensor_id": "S6",
      "hw_serial": "HW-S6-6641",
      "attestation_key_id": "AKID-S6",
      "model": "TL-200"
    }
  ],
  "calibrations": [
    {
      "calibration_id": "CAL-S1",
      "sensor_id": "S1",
      "kind": "initial",
      "valid_from": "2026-01-10T00:00:00Z",
      "valid_to": null,
      "bias_c": 0,
      "max_uncertainty_c": 0.3,
      "calibrated_by": "METRO-LAB",
      "certificate_ref": "CERT-2026-110",
      "corrects_calibration_id": null
    },
    {
      "calibration_id": "CAL-S2",
      "sensor_id": "S2",
      "kind": "initial",
      "valid_from": "2026-01-10T00:00:00Z",
      "valid_to": null,
      "bias_c": 0,
      "max_uncertainty_c": 0.3,
      "calibrated_by": "METRO-LAB",
      "certificate_ref": "CERT-2026-111",
      "corrects_calibration_id": null
    },
    {
      "calibration_id": "CAL-S4",
      "sensor_id": "S4",
      "kind": "initial",
      "valid_from": "2026-01-10T00:00:00Z",
      "valid_to": null,
      "bias_c": 0,
      "max_uncertainty_c": 0.3,
      "calibrated_by": "METRO-LAB",
      "certificate_ref": "CERT-2026-112",
      "corrects_calibration_id": null
    },
    {
      "calibration_id": "CAL-S5",
      "sensor_id": "S5",
      "kind": "initial",
      "valid_from": "2026-01-10T00:00:00Z",
      "valid_to": null,
      "bias_c": 0,
      "max_uncertainty_c": 0.3,
      "calibrated_by": "METRO-LAB",
      "certificate_ref": "CERT-2026-113",
      "corrects_calibration_id": null
    },
    {
      "calibration_id": "CAL-S6",
      "sensor_id": "S6",
      "kind": "initial",
      "valid_from": "2026-01-10T00:00:00Z",
      "valid_to": null,
      "bias_c": 0,
      "max_uncertainty_c": 0.3,
      "calibrated_by": "METRO-LAB",
      "certificate_ref": "CERT-2026-114",
      "corrects_calibration_id": null
    }
  ],
  "containers": [
    {
      "container_id": "C1",
      "kind": "reefer",
      "seal_id": "SEAL-C1-001",
      "note": "北京发车冷藏车"
    },
    {
      "container_id": "C2",
      "kind": "insulated_box",
      "seal_id": "SEAL-C2-009",
      "note": "法兰克福中转被动保温箱"
    },
    {
      "container_id": "C3",
      "kind": "passive_pack",
      "seal_id": "SEAL-C3-002",
      "note": "配送城市药房"
    },
    {
      "container_id": "C4",
      "kind": "passive_pack",
      "seal_id": "SEAL-C4-002",
      "note": "配送社区诊所"
    },
    {
      "container_id": "C5",
      "kind": "reefer",
      "seal_id": "SEAL-C5-007",
      "note": "疫苗冷藏车（中途掉线）"
    },
    {
      "container_id": "CF",
      "kind": "foam_wrapped",
      "seal_id": null,
      "note": "泡沫箱加铝箔纸，外观像冷链，无任何温控设备"
    }
  ],
  "batches": [
    {
      "batch_id": "B1",
      "product_name": "重组人胰岛素注射液",
      "initial_quantity": 100,
      "unit": "支",
      "manufacture_date": "2026-08-10"
    },
    {
      "batch_id": "B2",
      "product_name": "静注人免疫球蛋白",
      "initial_quantity": 40,
      "unit": "瓶",
      "manufacture_date": "2026-08-20"
    },
    {
      "batch_id": "B1-A",
      "product_name": "重组人胰岛素注射液（拆分配额60）",
      "initial_quantity": 60,
      "unit": "支",
      "manufacture_date": "2026-08-10"
    },
    {
      "batch_id": "B1-B",
      "product_name": "重组人胰岛素注射液（拆分配额40）",
      "initial_quantity": 40,
      "unit": "支",
      "manufacture_date": "2026-08-10"
    },
    {
      "batch_id": "B4",
      "product_name": "狂犬疫苗",
      "initial_quantity": 30,
      "unit": "支",
      "manufacture_date": "2026-08-25"
    },
    {
      "batch_id": "B3",
      "product_name": "人血白蛋白（来源不明）",
      "initial_quantity": 20,
      "unit": "瓶",
      "manufacture_date": "2026-07-01"
    }
  ],
  "tasks": [
    {
      "task_id": "T1",
      "carrier_party_id": "P-CAR",
      "temp_spec": {
        "min_c": 2,
        "max_c": 8
      },
      "route": [
        {
          "location": "北京",
          "tz": "Asia/Shanghai"
        },
        {
          "location": "法兰克福",
          "tz": "Europe/Berlin"
        }
      ]
    },
    {
      "task_id": "T2",
      "carrier_party_id": "P-DIST",
      "temp_spec": {
        "min_c": 2,
        "max_c": 8
      },
      "route": [
        {
          "location": "法兰克福",
          "tz": "Europe/Berlin"
        },
        {
          "location": "美因茨",
          "tz": "Europe/Berlin"
        }
      ]
    },
    {
      "task_id": "T3",
      "carrier_party_id": "P-DIST",
      "temp_spec": {
        "min_c": 2,
        "max_c": 8
      },
      "route": [
        {
          "location": "美因茨",
          "tz": "Europe/Berlin"
        },
        {
          "location": "城市药房",
          "tz": "Europe/Berlin"
        }
      ]
    },
    {
      "task_id": "T4",
      "carrier_party_id": "P-DIST",
      "temp_spec": {
        "min_c": 2,
        "max_c": 8
      },
      "route": [
        {
          "location": "美因茨",
          "tz": "Europe/Berlin"
        },
        {
          "location": "河畔社区诊所",
          "tz": "Europe/Berlin"
        }
      ]
    },
    {
      "task_id": "T5",
      "carrier_party_id": "P-CAR",
      "temp_spec": {
        "min_c": 2,
        "max_c": 8
      },
      "route": [
        {
          "location": "北京",
          "tz": "Asia/Shanghai"
        },
        {
          "location": "西安",
          "tz": "Asia/Shanghai"
        }
      ]
    }
  ],
  "parties": [
    {
      "party_id": "P-MFG",
      "name": "华北生物制药",
      "role": "manufacturer"
    },
    {
      "party_id": "P-CAR",
      "name": "洲际冷链",
      "role": "carrier"
    },
    {
      "party_id": "P-HUB",
      "name": "法兰克福分拨中心",
      "role": "hub"
    },
    {
      "party_id": "P-DIST",
      "name": "莱茵医药分销",
      "role": "distributor"
    },
    {
      "party_id": "P-PHA",
      "name": "城市药房",
      "role": "pharmacy"
    },
    {
      "party_id": "P-CLI",
      "name": "河畔社区诊所",
      "role": "clinic"
    },
    {
      "party_id": "P-GANG",
      "name": "无牌收购人",
      "role": "unlicensed"
    },
    {
      "party_id": "P-CLI2",
      "name": "益康诊所",
      "role": "clinic"
    }
  ],
  "events": [
    {
      "task_id": null,
      "location": "北京",
      "from_party": null,
      "to_party": null,
      "container_id": "C1",
      "from_container_id": null,
      "batch_ids": [],
      "outputs": [],
      "sensor_id": "S1",
      "seal_id": null,
      "note": null,
      "event_id": "E-ATT-S1",
      "at": "2026-09-01T01:00:00Z",
      "type": "attach",
      "signed_by": "EMP-WH-01"
    },
    {
      "task_id": "T1",
      "location": "北京",
      "from_party": "P-MFG",
      "to_party": null,
      "container_id": "C1",
      "from_container_id": null,
      "batch_ids": [
        "B1"
      ],
      "outputs": [],
      "sensor_id": null,
      "seal_id": "SEAL-C1-001",
      "note": null,
      "event_id": "E-PACK-B1",
      "at": "2026-09-01T01:05:00Z",
      "type": "pack",
      "signed_by": "EMP-WH-01"
    },
    {
      "task_id": "T1",
      "location": "北京",
      "from_party": "P-MFG",
      "to_party": "P-CAR",
      "container_id": "C1",
      "from_container_id": null,
      "batch_ids": [
        "B1"
      ],
      "outputs": [],
      "sensor_id": null,
      "seal_id": null,
      "note": null,
      "event_id": "E-HO-1",
      "at": "2026-09-01T01:12:00Z",
      "type": "handover",
      "signed_by": "EMP-DRV-01"
    },
    {
      "task_id": "T1",
      "location": null,
      "from_party": null,
      "to_party": null,
      "container_id": "C1",
      "from_container_id": null,
      "batch_ids": [],
      "outputs": [],
      "sensor_id": null,
      "seal_id": null,
      "note": null,
      "event_id": "E-DO-1O",
      "at": "2026-09-01T01:15:00Z",
      "type": "door_open",
      "signed_by": "EMP-DRV-01"
    },
    {
      "task_id": "T1",
      "location": null,
      "from_party": null,
      "to_party": null,
      "container_id": "C1",
      "from_container_id": null,
      "batch_ids": [],
      "outputs": [],
      "sensor_id": null,
      "seal_id": null,
      "note": null,
      "event_id": "E-DO-1C",
      "at": "2026-09-01T01:18:00Z",
      "type": "door_close",
      "signed_by": "EMP-DRV-01"
    },
    {
      "task_id": "T1",
      "location": "中转停机坪（当地12:20）",
      "from_party": null,
      "to_party": null,
      "container_id": "C1",
      "from_container_id": null,
      "batch_ids": [],
      "outputs": [],
      "sensor_id": null,
      "seal_id": null,
      "note": null,
      "event_id": "E-DO-2O",
      "at": "2026-09-01T12:20:00+02:00",
      "type": "door_open",
      "signed_by": "EMP-DRV-01"
    },
    {
      "task_id": "T1",
      "location": "中转停机坪",
      "from_party": null,
      "to_party": null,
      "container_id": "C1",
      "from_container_id": null,
      "batch_ids": [],
      "outputs": [],
      "sensor_id": null,
      "seal_id": null,
      "note": null,
      "event_id": "E-DO-2C",
      "at": "2026-09-01T11:00:00Z",
      "type": "door_close",
      "signed_by": "EMP-DRV-01"
    },
    {
      "task_id": null,
      "location": "法兰克福",
      "from_party": null,
      "to_party": null,
      "container_id": "C2",
      "from_container_id": null,
      "batch_ids": [],
      "outputs": [],
      "sensor_id": "S2",
      "seal_id": null,
      "note": null,
      "event_id": "E-ATT-S2",
      "at": "2026-09-01T13:50:00Z",
      "type": "attach",
      "signed_by": "EMP-HUB-02"
    },
    {